{
  "$schema": "http://json-schema.org/draft-07/schema#",
  "title": "Creduent Delegation Token",
  "type": "object",
  "required": [
    "token_id",
    "issued_at",
    "expires_at",
    "delegator",
    "delegate",
    "delegate_public_key",
    "constraints",
    "intent_hash",
    "signature"
  ],
  "properties": {
    "token_id": {
      "type": "string",
      "description": "Unique identifier for this delegation token"
    },
    "issued_at": {
      "type": "string",
      "format": "date-time",
      "description": "ISO 8601 timestamp of token issuance"
    },
    "expires_at": {
      "type": "string",
      "format": "date-time",
      "description": "ISO 8601 timestamp of token expiration"
    },
    "delegator": {
      "type": "string",
      "description": "Agent ID or public key of the delegating party"
    },
    "delegate": {
      "type": "string",
      "description": "Agent ID of the party receiving delegation"
    },
    "delegate_public_key": {
      "type": "string",
      "description": "Ed25519 public key of the delegate"
    },
    "constraints": {
      "type": "object",
      "required": [
        "capabilities",
        "reversibility_tier"
      ],
      "properties": {
        "capabilities": {
          "type": "array",
          "items": {
            "type": "string"
          },
          "description": "List of authorized capabilities or scopes"
        },
        "reversibility_tier": {
          "type": "string",
          "description": "Tier of operations permitted (e.g., READ_ONLY, REVERSIBLE, IRREVERSIBLE)"
        },
        "tools": {
          "type": "array",
          "items": {
            "type": "string"
          },
          "description": "Specific tools or endpoints authorized"
        },
        "limits": {
          "type": "object",
          "description": "Quantitative limits (e.g., rate limits, value limits)"
        }
      }
    },
    "intent_hash": {
      "type": "string",
      "description": "Cryptographic hash of the user intent or execution context"
    },
    "signature": {
      "type": "string",
      "description": "Ed25519 signature by the delegator over the JCS-canonicalized token payload"
    }
  }
}
