{"token_id": "cdt_dbc819fc9bd549cb8ee0a296425f23a9", "issued_at": "2026-08-04T07:18:03Z", "expires_at": "2026-08-04T08:18:03Z", "delegator": "agent://alice/agent", "delegate": "agent://bob/agent", "delegate_public_key": "li1tQT8rmQZzcL7b6ksWWncPsuiCnCu05K4FxhhMkRk=", "constraints": {"capabilities": ["*"], "reversibility_tier": "REVERSIBLE"}, "intent_hash": "none", "signature": "ciXRtL2OeCPTYkGD9UJTDBKXVM0wfG1vGr1Ci+outaT2jVGF7uKxOUMSzLfvJOJEzNsJvifPMrSXEqDVa/e5AQ=="}